<?xml version="1.0" encoding="UTF-8" standalone="yes"?>
<!-- edited with XMLSpy v2006 rel. 3 sp1 (http://www.altova.com) by x (EMBRACE) -->
<!--W3C Schema generated by XMLSpy v2006 rel. 3 sp1 (http://www.altova.com)-->
<xs:schema xmlns:xs="http://www.w3.org/2001/XMLSchema" elementFormDefault="qualified">
	<xs:element name="controller">
		<xs:complexType>
			<xs:sequence>
				<xs:element ref="name"/>
			</xs:sequence>
		</xs:complexType>
	</xs:element>
	<xs:element name="name" type="xs:string"/>
	<xs:element name="nfe-emissior">
		<xs:complexType>
			<xs:sequence>
				<xs:element ref="view" maxOccurs="unbounded"/>
			</xs:sequence>
		</xs:complexType>
	</xs:element>
	<xs:element name="view">
		<xs:complexType>
			<xs:sequence>
				<xs:element ref="name"/>
				<xs:element ref="controller"/>
			</xs:sequence>
		</xs:complexType>
	</xs:element>
</xs:schema>
